Question,Answer
Tại sao người bị U Xơ Thần Kinh lại dễ bị trầm cảm hơn?,"U Xơ Thần Kinh có thể dẫn đến nhiều triệu chứng gây ảnh hưởng đến cuộc sống hàng ngày, dẫn đến cảm giác bất lực, mệt mỏi và buồn chán, từ đó làm tăng nguy cơ trầm cảm."
Có phải U Xơ Thần Kinh gây dị dạng xương?,"Chắc chắn rồi, u phát triển gần xương có thể dẫn đến dị dạng xương, đặc biệt khi chúng gây ra sự phát triển bất thường của các mô xung quanh xương."
Thuốc có thể giúp tôi giảm đau do U Xơ Thần Kinh không?,"Có, thuốc có thể được sử dụng để giảm đau và kiểm soát các triệu chứng khác của U Xơ Thần Kinh."
" Bệnh U Xơ Thần Kinh có thể gây ra biến chứng khi phẫu thuật không? Nếu có, những biến chứng đó là gì?"," Bệnh U Xơ Thần Kinh ảnh hưởng đến các dây thần kinh và mô, nên phẫu thuật có thể gặp khó khăn và nguy cơ biến chứng cao, đặc biệt nếu các u xơ gần các vùng quan trọng như tủy sống hoặc não."
Bệnh U Xơ Thần Kinh có tác động gì đến khả năng sinh sản của phụ nữ?,"U Xơ Thần Kinh không ảnh hưởng trực tiếp đến khả năng sinh sản, nhưng nếu u xơ nằm ở các cơ quan sinh sản, có thể gây khó khăn trong thụ thai hoặc duy trì thai kỳ."
U Xơ Thần kinh có khả năng tác động đến dây thần kinh nằm ở ngoại biên?,"Khi U Xơ Thần kinh phát triển trên các dây thần kinh ngoại biên, chúng có khả năng gây ra các triệu chứng như tê liệt, yếu cơ hay mất cảm giác ở các chi."
Liệu bệnh u xơ thần kinh có liên quan đến các vấn đề về khớp không?,"Có, u xơ thần kinh có thể gây ra đau đớn hoặc cứng khớp do nằm gần hoặc tác động lên các dây thần kinh điều khiển khớp."
U xơ thần kinh có thể dẫn đến khó thở không?,"Mặc dù không phổ biến, nhưng việc u xơ phát triển gần phổi hoặc đường hô hấp có thể gây ra khó thở do chúng chèn ép lên các cơ quan hô hấp."
Những nốt sần xuất hiện trên da có thể là dấu hiệu của U Xơ Thần Kinh không?,"Có khả năng, đặc biệt là nếu những nốt sần này xuất hiện ở vùng nách hoặc bẹn, kèm theo các vết đốm café au lait."
U xơ thần kinh tác động như thế nào đến hiệu quả của các can thiệp y tế?,Một số dạng điều trị y tế có thể bị cản trở bởi u xơ thần kinh.
U xơ thần kinh và các vấn đề về thị lực: mối liên hệ là gì?,"U xơ thần kinh có thể gây ra các u xơ thần kinh ở mắt hoặc ảnh hưởng đến dây thần kinh thị giác, dẫn đến các vấn đề về thị lực như mờ mắt, giảm thị lực, hoặc thậm chí mù lòa."
"Nếu tôi bị bệnh u xơ thần kinh, tôi có thể gặp phải các vấn đề về tiêu hóa không?","Có thể, nếu các u xơ ảnh hưởng đến các dây thần kinh điều khiển hệ tiêu hóa, người bệnh có thể gặp phải các vấn đề như táo bón, tiêu chảy hoặc rối loạn tiêu hóa."
Bệnh lý mắt nào có thể liên quan đến U xơ thần kinh?,"U xơ thần kinh có thể gây ra các u xơ thần kinh ở mắt hoặc ảnh hưởng đến dây thần kinh thị giác, dẫn đến các vấn đề về thị lực như mờ mắt, giảm thị lực, hoặc thậm chí mù lòa."
"Trong trường hợp mắc U Xơ Thần Kinh, các khối u có thể phát triển ở những khu vực nào ngoài da?","Khi một người mắc U Xơ Thần Kinh, các khối u có thể hình thành ở nhiều vị trí khác bên cạnh da, chẳng hạn như não, tủy sống, mắt, xương và các cơ quan nội tạng."
Liệu U Xơ Thần Kinh có khả năng gây ra sự khác biệt về màu da không?,"Vâng. U Xơ Thần Kinh có thể dẫn đến tình trạng da không đồng đều về màu sắc, biểu hiện bằng những đốm đen hoặc nâu trên bề mặt da."
Phẫu thuật loại bỏ tất cả các u xơ trong bệnh U xơ thần kinh có hiệu quả không?,"Phẫu thuật có thể giúp loại bỏ những u xơ gây đau đớn hoặc ảnh hưởng đến chức năng, nhưng không thể loại bỏ toàn bộ bệnh U xơ thần kinh do tính chất di truyền và khả năng xuất hiện u mới."
U xơ thần kinh có thể gây đau đớn không?,"Có, u xơ thần kinh có thể gây ra các cơn đau, thường là đau nhói, đau âm ỉ, hoặc đau dữ dội, tùy thuộc vào vị trí và kích thước của u xơ."
 U xơ thần kinh có liên quan đến các vấn đề về tiêu hóa là như thế nào?," Trong một số trường hợp hiếm, u xơ thần kinh có thể hình thành trong hoặc xung quanh đường tiêu hóa, dẫn đến triệu chứng như đau bụng dữ dội, khó tiêu, chướng bụng, hoặc tắc nghẽn đường ruột."
Liệu bệnh u xơ thần kinh có thể gây rối loạn chức năng tình dục không?," Đúng vậy, u xơ thần kinh có khả năng gây ra các vấn đề về chức năng tình dục do ảnh hưởng đến các dây thần kinh điều khiển quá trình này."
Liệu U Xơ Thần Kinh có khiến cơ thể phản ứng quá mức với cơn đau không?,"U Xơ Thần Kinh có thể khiến hệ thần kinh trở nên quá nhạy cảm với các kích thích gây đau, dẫn đến các cơn đau dữ dội và kéo dài hơn khi các u xơ tác động lên dây thần kinh."
"Liệu người mắc U Xơ Thần Kinh có thể bị ảnh hưởng về mặt tâm lý, chẳng hạn như lo lắng hoặc trầm cảm không?","Có thể khẳng định như vậy. Những người mắc bệnh U Xơ Thần Kinh đôi lúc phải đối mặt với những khó khăn về mặt tâm lý, điển hình là bệnh lo âu hay bệnh trầm cảm, nhất là khi họ phải chịu đựng các triệu chứng kéo dài hoặc những biến chứng không lường trước được."
 Các yếu tố nào làm tăng nguy cơ u xơ thần kinh gây ra động kinh?,"Kích thước u xơ, vị trí u xơ trong não, tốc độ phát triển của u xơ, và có hay không các yếu tố di truyền đều làm tăng nguy cơ u xơ thần kinh gây ra động kinh."
 Bệnh nhân bị u xơ thần kinh có thể gặp vấn đề về đau khớp ở đâu?,"Bệnh nhân có thể gặp đau ở bất kỳ khớp nào mà u xơ thần kinh phát triển gần đó.  Tùy thuộc vào vị trí u, khớp bị ảnh hưởng có thể là khớp gối, khớp khuỷu, khớp cổ tay, hoặc các khớp khác."
 Các triệu chứng của u xơ thần kinh liên quan đến sự phát triển hệ thần kinh thường xuất hiện ở giai đoạn nào?,"Các triệu chứng liên quan đến sự phát triển hệ thần kinh do u xơ thần kinh có thể xuất hiện ở bất kỳ giai đoạn nào của cuộc đời, từ thời thơ ấu đến tuổi trưởng thành, tùy thuộc vào vị trí và loại u xơ thần kinh."
 Liệu U Xơ Thần Kinh có ảnh hưởng đến khả năng giữ nước tiểu không?," Có thể, nếu các u xơ thần kinh gây áp lực lên hoặc tổn thương các dây thần kinh điều khiển bàng quang, dẫn đến khó khăn trong việc giữ nước tiểu."
U xơ thần kinh tác động đến khả năng học tập của trẻ như thế nào?,"U xơ thần kinh có thể ảnh hưởng đến chức năng học tập ở trẻ em bằng cách gây ra những rối loạn về sự tập trung, trí nhớ và khả năng xử lý thông tin, do sự phát triển của não bộ bị tác động bởi các u xơ."
U xơ thần kinh có thể gây ra vấn đề về tai không?," Đúng, nếu u xơ thần kinh phát triển gần hoặc dọc theo đường dẫn truyền tín hiệu thính giác, nó có thể gây ra các vấn đề về tai, bao gồm mất thính lực hoặc ù tai."
Bệnh u xơ thần kinh não ảnh hưởng đến chức năng não như thế nào?,"U xơ trong não có thể ảnh hưởng đến các quá trình nhận thức, bao gồm trí nhớ, khiến việc nhớ lại thông tin trở nên khó khăn."
Bệnh u xơ thần kinh có thể gây ra vấn đề gì về học tập?,"Bệnh u xơ thần kinh có thể gây ra những vấn đề về học tập, tập trung hoặc xử lý thông tin, đặc biệt là ở trẻ em, nếu chúng ảnh hưởng đến não bộ."
Liệu tôi có dễ mắc các bệnh thần kinh hơn nếu tôi mắc bệnh U Xơ Thần Kinh?,"Đúng vậy, bệnh nhân U Xơ Thần Kinh có xu hướng dễ mắc các vấn đề về thần kinh như động kinh và suy nhược do sự phát triển của các khối u xơ trên dây thần kinh hoặc trong não."
Ảnh hưởng điển hình của U Xơ Thần Kinh đối với giấc ngủ là gì?,"Các triệu chứng của bệnh, chủ yếu là đau và tê bì, thường gây ra tình trạng mất ngủ, làm giảm rõ rệt chất lượng giấc ngủ tổng thể của người bệnh."
U xơ thần kinh có thể gây tê hoặc ngứa không?,"Có thể, nếu u xơ chèn ép dây thần kinh cảm giác, chúng có thể gây ra cảm giác tê, ngứa ran hoặc mất cảm giác ở vùng bị ảnh hưởng."
Tuổi thọ trung bình của một người mắc bệnh U Xơ Thần Kinh là bao nhiêu?,"Tuổi thọ dự kiến của những người mắc bệnh U Xơ Thần Kinh rất khác nhau tùy thuộc vào mức độ nghiêm trọng của tình trạng, loại phụ U Xơ Thần Kinh và chất lượng chăm sóc y tế. Tuy nhiên, với sự điều trị và quản lý thích hợp, nhiều bệnh nhân có thể có tuổi thọ bình thường."
 Liệu U Xơ Thần Kinh có liên quan đến các rối loạn tâm lý như trầm cảm không?,"Có, bệnh U Xơ Thần Kinh có thể gây ra lo âu, trầm cảm và các vấn đề tâm lý khác, đặc biệt khi các triệu chứng bệnh làm giảm chất lượng cuộc sống hoặc gây căng thẳng về mặt sức khỏe."
 Người bị u xơ thần kinh có thể gặp vấn đề với ngôn ngữ viết hay không?,"Có thể.  Phát triển u xơ trong các vùng não kiểm soát ngôn ngữ có thể dẫn đến khó khăn trong việc viết, hiểu văn bản, hay diễn đạt bằng văn bản."
Liệu pháp nào hiệu quả nhất cho U Xơ Thần Kinh?,"Không có phương pháp điều trị nào là ""hiệu quả nhất"" cho U Xơ Thần Kinh,  nhưng thuốc có thể giúp kiểm soát các triệu chứng như động kinh, đau đớn hoặc các vấn đề thần kinh khác."
 Tôi có thể làm gì để bảo vệ thận của mình khi bị u xơ thần kinh?," Hãy theo dõi sức khỏe thường xuyên, đi khám bác sĩ định kỳ, tuân thủ phác đồ điều trị và duy trì lối sống lành mạnh."
Hãy giải thích mối liên quan giữa U Xơ Thần Kinh và sức khỏe tim mạch.,"Trong một số trường hợp, U Xơ Thần Kinh có thể gây ra các vấn đề về tim mạch do chúng tác động lên các mạch máu gần đó, dẫn đến lưu thông máu kém."
"Ngoài vết bớt café au lait, người mắc U Xơ Thần Kinh có thể gặp những vấn đề nào về da?","Những người bị U Xơ Thần Kinh có thể gặp các vấn đề về da khác ngoài vết café au lait, bao gồm mụn cóc, u xơ dưới da và các thay đổi bất thường trên da."
Bệnh U Xơ Thần Kinh có gây khó khăn trong việc hình thành câu và diễn đạt ý tưởng không?,"Vâng, bệnh U Xơ Thần Kinh có thể ảnh hưởng đến các vùng não liên quan đến chức năng ngôn ngữ và giao tiếp, dẫn đến khó khăn trong việc hình thành câu và diễn đạt ý tưởng."
 Làm thế nào để xác định liệu u xơ thần kinh có ảnh hưởng đến xương khớp của tôi không?,"Chẩn đoán cụ thể cần được thực hiện bởi bác sĩ chuyên khoa dựa trên triệu chứng, tiền sử bệnh và kết quả hình ảnh chẩn đoán như chụp X-quang, chụp CT hay MRI."
U xơ thần kinh có thể gây ra các vấn đề về mắt không?,"Có, các u xơ thần kinh có thể phát triển trong hoặc gần mắt, gây ra các vấn đề về thị lực như mờ mắt, giảm thị lực hoặc các vấn đề về mắt nghiêm trọng khác."
"Khi mắc U Xơ Thần Kinh, khả năng giữ thăng bằng của tôi có bị ảnh hưởng không?","Đúng, nếu các U Xơ Thần Kinh nằm ở những khu vực não hoặc tủy sống liên quan đến chức năng cân bằng, chúng có thể dẫn đến tình trạng chóng mặt và khiến việc giữ thăng bằng trở nên khó khăn hơn khi đi lại."
Liệu U xơ thần kinh có thể ảnh hưởng đến khả năng nhìn của tôi?,"U xơ thần kinh có thể gây ra các u xơ thần kinh ở mắt hoặc ảnh hưởng đến dây thần kinh thị giác, dẫn đến các vấn đề về thị lực như mờ mắt, giảm thị lực, hoặc thậm chí mù lòa."
Các u xơ trong U Xơ Thần Kinh có để lại dấu vết trên da không?,"U Xơ Thần Kinh thường có các vết café au lait, nhưng trong某些情况下, 如果u xơ受到外力作用或手术，它们可能会导致疤痕或皮肤变色。"
Bệnh U Xơ Thần Kinh có khiến tôi có khả năng cao hơn mắc các bệnh về thần kinh không?,Người mắc bệnh U Xơ Thần Kinh có nguy cơ cao hơn mắc các bệnh về thần kinh như động kinh và suy yếu chức năng do các khối u xơ tích tụ trên dây thần kinh hoặc trong não.
U Xơ Thần Kinh có gây biến dạng xương không?,"Đúng vậy. Các u gần xương có thể dẫn đến biến dạng xương, đặc biệt khi chúng gây ra sự phát triển bất thường của các mô bao quanh xương."
" Trong trường hợp u xơ thần kinh lan rộng và gây ra các vấn đề về thần kinh nghiêm trọng, có những phương pháp điều trị nào?"," Trong trường hợp u xơ thần kinh lan rộng, gây ra các vấn đề thần kinh nghiêm trọng, các phương pháp điều trị sẽ tùy thuộc vào tình trạng cụ thể của mỗi người, bao gồm sử dụng thuốc để kiểm soát các triệu chứng, phẫu thuật loại bỏ các u xơ, hoặc liệu pháp vật lý để cải thiện chức năng vận động."
U Xơ Thần Kinh có làm cơn đau trở nên nghiêm trọng hơn không?,"Do u xơ gây kích ứng hoặc chèn ép dây thần kinh, U Xơ Thần Kinh thường làm các cơn đau dữ dội hơn so với người bình thường, đồng thời cơn đau có thể kéo dài dai dẳng."
 Một người bị u xơ thần kinh trong não có thể gặp khó khăn gì khi học?,"Khó khăn trong việc học thuộc bài, khó tập trung nghe giảng, khó nhớ lại những gì đã học, khó hiểu và xử lý thông tin mới, dễ quên, hoặc có thể xuất hiện tình trạng mất tập trung, giảm khả năng ghi nhớ, khó khăn trong học hỏi ngôn ngữ mới hoặc các kỹ năng mới."
Liệu các u xơ thần kinh có tác động đến tâm trạng của người bệnh?,"Nếu u xơ thần kinh ảnh hưởng đến các khu vực não liên quan đến cảm xúc, nó có thể gây ra các biến đổi tâm trạng như cáu giận, lo lắng hoặc trầm cảm."
Bệnh U Xơ Thần Kinh có gây khó khăn trong việc mang thai không?,"Mặc dù bệnh U Xơ Thần Kinh không ảnh hưởng trực tiếp đến khả năng sinh sản, nhưng các vấn đề sức khỏe liên quan đến bệnh có thể ảnh hưởng đến chất lượng cuộc sống và sức khỏe chung, làm giảm khả năng sinh sản."
Liệu bệnh U Xơ Thần Kinh có làm ảnh hưởng nghiêm trọng đến chất lượng cuộc sống không?," Không nhất thiết.  Nhiều người mắc U Xơ Thần Kinh có thể sống cuộc sống gần như bình thường nếu bệnh được phát hiện sớm và quản lý hiệu quả. Tuy nhiên, mức độ ảnh hưởng phụ thuộc vào vị trí, kích thước, và số lượng các u xơ, cũng như cách chúng ảnh hưởng đến chức năng thần kinh."
 Bệnh U Xơ Thần Kinh có thể gây ra những ảnh hưởng gì cho thị lực?," U Xơ Thần Kinh có thể gây u xơ trên dây thần kinh thị giác, dẫn đến các vấn đề về thị lực như giảm thị lực, mờ mắt hoặc thậm chí mất thị lực nếu không được điều trị kịp thời."
 Các triệu chứng mất thính giác do u xơ thần kinh có thể như thế nào?,"Các triệu chứng có thể bao gồm mất thính giác một bên hoặc hai bên, ù tai, khó khăn trong nhận biết âm thanh hoặc khó phân biệt lời nói trong tiếng ồn."
 Có phải tất cả các u xơ thần kinh đều gây mất thính giác không?,"Không, không phải tất cả các u xơ thần kinh đều gây ảnh hưởng đến thính giác.  Chỉ những u xơ nằm gần hoặc ảnh hưởng đến dây thần kinh tai hoặc đường dẫn truyền thính giác mới có khả năng gây ra vấn đề về thính giác."
U xơ thần kinh có thể ảnh hưởng đến khả năng nói của trẻ em không?,"Có, u xơ thần kinh có thể ảnh hưởng đến khả năng nói của trẻ em nếu chúng ảnh hưởng đến các khu vực não liên quan đến việc kiểm soát ngôn ngữ. Điều này có thể dẫn đến chậm nói, khó phát âm hoặc các vấn đề về ngôn ngữ khác."
U xơ thần kinh ảnh hưởng đến tâm lý người bệnh như thế nào?,"Một số trường hợp u xơ thần kinh phát triển có thể làm thay đổi tâm trạng, hành vi và tính cách do ảnh hưởng đến các vùng não kiểm soát cảm xúc và hành vi."
 U xơ thần kinh có thể gây ra triệu chứng nào liên quan đến tổn thương mạch máu não?,"Các triệu chứng có thể bao gồm đau đầu dữ dội, chóng mặt, yếu liệt một bên cơ thể, mất thị lực, hoặc thậm chí là ngất xỉu. Quan trọng là phải đi khám bác sĩ nếu có những triệu chứng này."
 Tôi có thể làm gì để giảm nguy cơ mắc U Xơ Thần Kinh?,"Rất tiếc, không có cách nào để giảm nguy cơ mắc U Xơ Thần Kinh, vì đây là bệnh di truyền.  Tuy nhiên, việc giữ sức khỏe tốt và thăm khám định kỳ có thể giúp kiểm soát bệnh nếu đã mắc bệnh."
 Bác sĩ có thể chẩn đoán sự thay đổi tính cách liên quan đến u xơ thần kinh bằng cách nào?,"Bác sĩ sẽ dựa vào đánh giá lâm sàng, kết hợp với các xét nghiệm hình ảnh (như chụp MRI) để xác định vị trí và kích thước của u xơ, cũng như các triệu chứng cụ thể của bệnh nhân để chẩn đoán sự thay đổi tính cách liên quan."
 U xơ thần kinh có thể gây ra chứng mất ngủ mãn tính không?,"Mặc dù không phải tất cả trường hợp đều dẫn đến chứng mất ngủ mãn tính, các vấn đề về giấc ngủ liên quan đến u xơ thần kinh có thể trở nên mãn tính nếu không được điều trị thích hợp.  Điều này có thể gây ảnh hưởng tiêu cực đáng kể đến sức khỏe và chất lượng cuộc sống."
Bệnh U Xơ Thần Kinh có tiềm ẩn nguy cơ gây khó thở cho tôi không?,"Trong những trường hợp không phổ biến, các u xơ thần kinh có khả năng phát triển gần các cơ quan hô hấp, gây ra khó thở hoặc các vấn đề về hô hấp do chúng chèn ép lên đường hô hấp."
U xơ thần kinh có ảnh hưởng gì đến khả năng đi lại của bệnh nhân?,"Nếu u xơ thần kinh phát triển ở khu vực liên quan đến vận động, chúng có thể gây ra yếu cơ, mất thăng bằng hoặc hạn chế khả năng đi lại."
Có khả năng nào U Xơ Thần Kinh gây ra vấn đề về thính giác hoặc giao tiếp không?,"Mặc dù tình trạng này không phổ biến nhưng nếu các khối u phát triển trong khu vực lân cận các dây thần kinh tại hoặc liên quan tới phần não chịu trách nhiệm kiểm soát ngôn ngữ, chúng có khả năng làm ảnh hưởng tới thính giác hoặc khả năng diễn đạt của người bệnh."
U Xơ Thần Kinh có thể tác động đến chức năng tuyến giáp không?,"Vâng, nếu các u xơ phát triển gần đó, U Xơ Thần Kinh có thể đôi khi ảnh hưởng đến tuyến giáp, gây ra các vấn đề như tuyến giáp hoạt động kém hoặc hoạt động quá mức."
 Làm thế nào để điều trị u xơ thần kinh?," Điều trị u xơ thần kinh có thể bao gồm sử dụng thuốc giảm đau, thuốc chống động kinh để kiểm soát các triệu chứng, phẫu thuật để loại bỏ khối u, và liệu pháp tâm lý để giải quyết những vấn đề về tinh thần."
Liệu tình trạng Bệnh U Xơ Thần Kinh có khiến bạn dễ mắc thêm các bệnh liên quan đến thần kinh hay không?,"Có, bệnh nhân bị U Xơ Thần Kinh sẽ dễ phát triển thêm các vấn đề về thần kinh như động kinh hoặc suy giảm nhận thức, do các khối u xơ hình thành trên dây thần kinh hoặc trong não."
U xơ thần kinh có thể gây ra các vấn đề về hô hấp không?,"Mặc dù hiếm, nhưng nếu các u xơ phát triển gần phổi hoặc các cơ quan hô hấp, chúng có thể gây khó thở hoặc các vấn đề về hô hấp."
Người bị u xơ thần kinh có nguy cơ đột quỵ cao hơn không?," Có khả năng u xơ thần kinh có thể làm tăng nguy cơ đột quỵ, đặc biệt là nếu chúng nằm gần các mạch máu trong não hoặc tủy sống."
U Xơ Thần Kinh trên da đầu ảnh hưởng đến tóc như thế nào?,Các khối u do Bệnh U Xơ Thần Kinh trên da đầu có thể gây rụng tóc hoặc đau đớn ở vùng da đó.
"Nếu bệnh nhân gặp khó khăn giao tiếp vì u xơ, những liệu pháp nào có thể hỗ trợ?","Có nhiều liệu pháp hỗ trợ, tùy thuộc vào mức độ ảnh hưởng. Có thể bao gồm liệu pháp ngôn ngữ, hỗ trợ từ người chăm sóc, và các phương pháp hỗ trợ giao tiếp khác như sử dụng đồ họa, ký hiệu hoặc các ứng dụng công nghệ."
"Tôi bị bệnh U Xơ Thần Kinh, và tôi cảm thấy rất mệt mỏi. Liệu điều này có liên quan đến bệnh của tôi không?"," Có thể, những cơn đau và các triệu chứng thần kinh liên tục từ bệnh U Xơ Thần Kinh có thể khiến người bệnh cảm thấy mệt mỏi và kiệt sức, đặc biệt là khi bạn phải đối mặt với các vấn đề tâm lý."
Bệnh U Xơ Thần Kinh có thể làm giảm chất lượng cuộc sống của người bệnh bằng cách nào?,"U Xơ Thần Kinh có thể gây ra các triệu chứng như đau đớn, vấn đề về da và biến chứng thần kinh, dẫn đến căng thẳng, lo lắng và khó khăn trong các hoạt động hàng ngày, từ đó làm giảm chất lượng cuộc sống của người bệnh."
Có cách nào để phẫu thuật trị dứt điểm bệnh U xơ thần kinh?,"Phẫu thuật có thể giúp loại bỏ những u xơ gây khó chịu hoặc ảnh hưởng đến chức năng, nhưng không thể loại bỏ hoàn toàn bệnh U xơ thần kinh vì nó có tính di truyền và các u mới có thể xuất hiện."
Có phải U xơ thần kinh khiến khó thụ thai ở nam giới không?," Các triệu chứng của U xơ thần kinh, như rối loạn vận động và đau đớn kéo dài, có thể làm giảm khả năng sinh sản ở nam giới.  Điều này không phải do ảnh hưởng trực tiếp đến tinh trùng, mà do tác động tiêu cực đến ham muốn tình dục và khả năng thực hiện quan hệ tình dục."
 U xơ thần kinh ở đâu có thể ảnh hưởng nhiều nhất đến sự phối hợp?,U xơ thần kinh ở các vùng não bộ hoặc tủy sống chịu trách nhiệm cho việc điều khiển vận động và giữ thăng bằng sẽ gây ra ảnh hưởng nhiều nhất đến khả năng phối hợp của cơ thể.
 Khi nào bệnh u xơ thần kinh có thể ảnh hưởng đến khả năng vận động?,"Khi các u xơ ảnh hưởng đến các dây thần kinh chi phối vận động, người bệnh có thể gặp khó khăn trong việc di chuyển, đi lại hoặc thực hiện các động tác thể chất."
