Question,Answer
 Những loại biến dạng xương nào có thể do u xơ thần kinh gây ra?,"U xơ thần kinh có thể gây ra nhiều loại biến dạng xương, từ biến dạng nhẹ đến nghiêm trọng, tùy thuộc vào kích thước và vị trí của u xơ."
 Bệnh u xơ thần kinh có di truyền không?,"Có, bệnh u xơ thần kinh là một bệnh di truyền."
 Bệnh U Xơ Thần Kinh có thể khiến người bệnh bị trầm cảm không?,"Bệnh có thể ảnh hưởng đến tâm lý của bệnh nhân, đặc biệt là đối với trẻ em, khi các thay đổi về ngoại hình hoặc vấn đề sức khỏe có thể gây lo lắng và giảm sự tự tin. Mặc dù không trực tiếp gây trầm cảm, bệnh có thể góp phần vào việc gia tăng nguy cơ trầm cảm do những thay đổi tâm lý mà nó gây ra."
Bệnh U Xơ Thần Kinh có thể khiến người bệnh cảm thấy mệt mỏi thường xuyên không?,"U Xơ Thần Kinh có thể gây ra cảm giác mệt mỏi thường xuyên do đau đớn, khó ngủ, hoặc giảm khả năng vận động."
Phẫu thuật U Xơ Thần Kinh có thể gây ra những hậu quả tiêu cực nào?,"Phẫu thuật U Xơ Thần Kinh có thể dẫn đến các biến chứng sau: nhiễm trùng, chảy máu và tổn thương dây thần kinh."
U xơ thần kinh có thể gây đột quỵ không?,"Một số nghiên cứu đã chỉ ra rằng nếu u xơ phát triển gần mạch máu trong não hoặc tủy sống, chúng có thể làm tăng nguy cơ đột quỵ hoặc các vấn đề liên quan đến tuần hoàn máu."
Bệnh nhân U Xơ Thần Kinh thường gặp phải những triệu chứng gì trên da?,"Bên cạnh các vết đốm café au lait, bệnh U Xơ Thần Kinh có thể gây ra mụn cóc hoặc các nốt sần trên da, thường tập trung ở vùng nách hoặc bẹn."
 U xơ thần kinh có thể gây ra đột quỵ?,"Trong một số trường hợp, u xơ thần kinh có thể góp phần làm tăng nguy cơ đột quỵ nếu nó gây áp lực lên hoặc ảnh hưởng đến các mạch máu não."
U Xơ Thần Kinh có thể gây ra các hậu quả tiêu cực cho hệ thống tim mạch như thế nào?,"U Xơ Thần Kinh có thể gián tiếp gây ra các vấn đề về tim mạch bằng cách tác động lên các mạch máu gần đó, dẫn đến lưu thông máu bị hạn chế."
Làm sao để giảm nguy cơ u xơ thần kinh tái phát sau phẫu thuật?,"Không có cách nào đảm bảo ngăn chặn hoàn toàn việc u xơ thần kinh tái phát, nhưng việc theo dõi sức khỏe định kỳ, kiểm tra thường xuyên và điều trị sớm có thể giúp giảm thiểu nguy cơ."
Khi nào thì thực hiện phẫu thuật U Xơ Thần Kinh tiềm ẩn rủi ro?,"Phẫu thuật U Xơ Thần Kinh có thể gây ra biến chứng khi khối u có kích thước lớn hoặc nằm ở vị trí gây khó khăn trong quá trình tiếp cận. Những yếu tố này có thể làm tăng nguy cơ nhiễm trùng, chảy máu và tổn thương dây thần kinh."
Bệnh U Xơ Thần Kinh có khả năng gây thay đổi về tình trạng của tóc không?,"Đúng vậy, sự xuất hiện của các u xơ thần kinh ở vùng da đầu có thể ảnh hưởng đến sự phát triển của tóc bằng cách gây ra tình trạng rụng tóc, mọc tóc không đều hoặc các bất thường khác về tóc."
Có thể thực hiện những bước nào để giảm nguy cơ mắc phải các khối u thần kinh không?,"Do tính chất di truyền của U Xơ Thần Kinh, chúng ta hiện chưa có biện pháp phòng ngừa nào để ngăn chặn sự phát triển của các khối u này. Thay vào đó, theo dõi sức khỏe thường xuyên và nhận được sự chăm sóc y tế thích hợp có thể giúp giảm thiểu các rủi ro tiềm ẩn."
Những người mắc Bệnh U Xơ Thần Kinh có thể có con khỏe mạnh không?,"Mặc dù Bệnh U Xơ Thần Kinh là bệnh di truyền, nhưng con cái của người mắc bệnh vẫn có 50% khả năng không bị mắc bệnh nếu họ không thừa hưởng gen bệnh."
" Nếu triệu chứng u xơ thần kinh nặng hơn, cần phải làm gì?","Nếu triệu chứng u xơ thần kinh trở nên nghiêm trọng hơn, bạn cần liên hệ ngay với bác sĩ để được đánh giá và điều chỉnh phương pháp điều trị phù hợp."
"U xơ thần kinh và cảm xúc, mối liên hệ nào giữa chúng?"," U xơ thần kinh có thể ảnh hưởng đến các vùng não liên quan đến cảm xúc, dẫn đến các vấn đề về kiểm soát cảm xúc như: cáu giận, lo âu, trầm cảm, khó khăn trong việc xử lý các tình huống căng thẳng."
 Những vấn đề về giấc ngủ do u xơ thần kinh thường biểu hiện như thế nào?,"Những vấn đề về giấc ngủ do u xơ thần kinh thường thể hiện qua khó đi vào giấc ngủ, thức giấc thường xuyên vào ban đêm, khó duy trì giấc ngủ, mệt mỏi kéo dài, và cảm giác không được nghỉ ngơi đầy đủ sau khi ngủ.  Đau và tê bì ở các vùng bị ảnh hưởng cũng có thể gây khó chịu và thức giấc."
"U xơ thần kinh có thể gây nên các vấn đề về vị giác, khiến thực phẩm mất đi hương vị?","Đúng vậy, trong những trường hợp hiếm gặp, khi các khối u tác động đến dây thần kinh cảm thụ vị giác, bệnh nhân u xơ thần kinh có thể trải qua những thay đổi về vị giác, bao gồm mất hoàn toàn khả năng cảm nhận mùi vị hoặc cảm thấy vị đắng."
 Có cách nào để quản lý triệu chứng u xơ thần kinh và cải thiện đời sống tình dục không?,"Có.  Tùy thuộc vào triệu chứng cụ thể, các phương pháp như điều trị đau, vật lý trị liệu, hỗ trợ tâm lý, hoặc tìm kiếm các giải pháp thay thế có thể giúp quản lý các triệu chứng và cải thiện chất lượng đời sống tình dục của người bệnh.  Nói chuyện với bác sĩ hoặc chuyên gia tư vấn là rất quan trọng."
"Bệnh u xơ thần kinh có gây ra tê bì chân tay, yếu cơ hoặc đau nhức dọc theo các chi không?","Có thể, nếu các u xơ phát triển trên các dây thần kinh ngoại vi, chúng có thể gây ra các triệu chứng như tê bì, yếu cơ hoặc đau nhức dọc theo các chi."
Những triệu chứng nào liên quan đến ảnh hưởng của u xơ thần kinh lên huyết áp?,"Các triệu chứng có thể bao gồm: đau đầu, chóng mặt, hoa mắt, khó thở, mệt mỏi, và các triệu chứng liên quan đến tuần hoàn kém, tùy thuộc vào mức độ ảnh hưởng lên huyết áp và vị trí của u xơ."
Tỉ lệ tái phát sau phẫu thuật u xơ thần kinh là bao nhiêu?,"Không có tỉ lệ chính xác cho việc tái phát sau phẫu thuật u xơ thần kinh, vì nó phụ thuộc vào nhiều yếu tố, bao gồm di truyền, vị trí của u xơ và kích thước của chúng. Tuy nhiên, do bản chất di truyền của bệnh, khả năng tái phát là có."
 Sự ảnh hưởng của u xơ thần kinh đến khả năng nhận thức và tư duy là gì?,"Nếu u xơ phát triển trong não, chúng có thể ảnh hưởng đến khả năng tư duy, ra quyết định và khả năng nhận thức, gây khó khăn trong học tập và làm việc."
Bệnh U Xơ Thần Kinh có thể ảnh hưởng đến thị lực như thế nào?,"U Xơ Thần Kinh có thể gây ra các vấn đề về mắt, chẳng hạn như u thần kinh thị giác, gây giảm thị lực hoặc có thể dẫn đến các vấn đề nghiêm trọng hơn nếu không được điều trị kịp thời."
Các triệu chứng nào cho thấy u xơ thần kinh có thể gây khó thở hoặc nuốt?,"Các triệu chứng cho thấy u xơ thần kinh có thể gây khó thở hoặc nuốt bao gồm khó thở, khó nuốt, đau khi nuốt, cảm giác nghẹt thở, ho, khàn tiếng."
 U xơ thần kinh có ảnh hưởng gì đến vận động của cơ bắp?," U xơ thần kinh có thể ảnh hưởng đến vận động của cơ bắp bằng cách gây yếu cơ, tê liệt hoặc hạn chế khả năng kiểm soát cơ bắp, dẫn đến khó khăn trong việc thực hiện các hoạt động hàng ngày."
Bệnh u xơ thần kinh có gây rối loạn chức năng tình dục không?,"Bệnh u xơ thần kinh không trực tiếp gây rối loạn chức năng tình dục. Tuy nhiên, các triệu chứng như đau, tê, yếu cơ do bệnh gây ra có thể ảnh hưởng tiêu cực đến đời sống tình dục, gây khó khăn trong các hoạt động tình dục và cảm nhận khoái cảm."
" Ngoài lo âu, U Xơ Thần Kinh còn gây ra những vấn đề tâm lý nào khác?"," Bệnh U Xơ Thần Kinh có thể gây ra lo âu, trầm cảm và các vấn đề tâm lý khác, đặc biệt khi các triệu chứng bệnh làm giảm chất lượng cuộc sống hoặc gây căng thẳng về mặt sức khỏe."
 Liệu bệnh U Xơ Thần Kinh có tác động đến khả năng học tập của trẻ em?," Có, bệnh U Xơ Thần Kinh có thể gây ra những khó khăn đáng kể trong việc học tập của trẻ em."
Tôi nên làm gì nếu tôi nghi ngờ rằng mình bị U Xơ Thần Kinh ảnh hưởng đến mắt?,"Nếu bạn nghi ngờ rằng mình bị U Xơ Thần Kinh ảnh hưởng đến mắt, hãy liên hệ ngay với bác sĩ để được chẩn đoán và điều trị kịp thời."
Có mối liên hệ nào giữa bệnh U Xơ Thần Kinh và các vấn đề về lời nói không?,"Có, bệnh U Xơ Thần Kinh có thể khiến người bệnh gặp khó khăn về lời nói, bao gồm cả những khó khăn trong việc tạo ra âm thanh và hình thành từ."
Có phải U Xơ Thần Kinh là nguyên nhân gây ra nhiễm trùng không?,"Không phải vậy. Bệnh U Xơ Thần Kinh không trực tiếp gây nhiễm trùng. Tuy nhiên, các thủ thuật y tế được thực hiện để điều trị U Xơ Thần Kinh có thể làm tăng nguy cơ nhiễm trùng."
Liệu pháp nào được sử dụng để điều trị u xơ thần kinh ở tủy sống?,"Các phương pháp điều trị u xơ thần kinh ở tủy sống bao gồm phẫu thuật, xạ trị, và liệu pháp hóa học."
 Tôi có thể nhận biết sớm dấu hiệu của u xơ thần kinh ảnh hưởng đến hô hấp là gì?,"Dấu hiệu có thể bao gồm khó thở, cảm giác tức ngực, thở gấp, hoặc thở khò khè. Tuy nhiên, đây không phải là các dấu hiệu đặc trưng chỉ của u xơ thần kinh, vì vậy quan trọng là phải tham khảo ý kiến bác sĩ để chẩn đoán chính xác."
" Nếu phát hiện u xơ thần kinh, cần áp dụng những liệu pháp gì?","Khi phát hiện u xơ thần kinh, có thể cần đến thuốc chống co giật, phẫu thuật cắt bỏ các u lớn, và quan sát, theo dõi thường xuyên để kiểm soát triệu chứng."
" Tôi bị u xơ thần kinh, tôi có cần phải theo dõi chức năng thận không?", Nên theo dõi chức năng thận thường xuyên để đảm bảo sức khỏe. Bác sĩ có thể chỉ định các xét nghiệm cần thiết.
 Đau đầu do u xơ thần kinh khác với đau đầu thông thường như thế nào?," Đau đầu do u xơ thần kinh có thể có đặc điểm khác biệt về vị trí, cường độ, và tần suất so với đau đầu thông thường.  Nó cũng có thể liên quan đến các triệu chứng khác như rối loạn thị lực hoặc tê bì."
U Xơ Thần Kinh có phải là căn nguyên gây ngứa?,Các khối u thần kinh có liên quan đến U Xơ Thần Kinh có thể gây ngứa nếu chúng hình thành gần bề mặt da hoặc chịu tác động làm kích thích do sự phát triển của những khối u này.
" Nếu triệu chứng da liễu do u xơ thần kinh xuất hiện ở trẻ em, liệu pháp điều trị có khác với người lớn không?"," Phương pháp điều trị cho trẻ em sẽ tùy thuộc vào vị trí, kích thước và mức độ ảnh hưởng của u xơ thần kinh.  Cần sự theo dõi sát sao của các chuyên gia y tế, bao gồm bác sĩ da liễu, thần kinh học và bác sĩ nhi.  Chế độ điều trị có thể sẽ tập trung vào kiểm soát đau, giảm kích ứng và bảo vệ làn da, tránh để lại sẹo."
 Tôi có thể được hỗ trợ như thế nào khi đối mặt với u xơ thần kinh?," Ngoài việc điều trị y tế (thuốc và phẫu thuật), việc được hỗ trợ tâm lý, tư vấn hoặc trị liệu là rất cần thiết.  Điều này có thể giúp bạn đối phó với các tác động tinh thần của bệnh và cải thiện chất lượng cuộc sống."
U xơ thần kinh ảnh hưởng như thế nào đến khả năng học tập và vận động của trẻ?,"Bệnh u xơ thần kinh có thể ảnh hưởng đến sự phát triển thể chất và trí tuệ của trẻ, gây khó khăn trong việc học tập và vận động."
Bệnh U Xơ Thần Kinh có thể ảnh hưởng đến khả năng mang thai như thế nào?,"Bệnh U Xơ Thần Kinh không trực tiếp ảnh hưởng đến khả năng mang thai. Tuy nhiên, các vấn đề sức khỏe liên quan đến bệnh có thể ảnh hưởng đến chất lượng cuộc sống và sức khỏe chung, gây khó khăn trong việc mang thai."
" Nếu u xơ thần kinh phát triển ở một khu vực cụ thể trên hệ thần kinh, sẽ dẫn đến hậu quả gì?","Nếu u xơ thần kinh phát triển ở một khu vực cụ thể trên hệ thần kinh, ví dụ như gần dây thần kinh, nó có thể gây ra đau, tê hoặc mất cảm giác ở khu vực chi phối bởi dây thần kinh đó.  Trong một số trường hợp, nó có thể gây ra yếu cơ, khó khăn trong vận động hoặc mất kiểm soát các chức năng cơ quan."
Liệu thuốc có thể giúp chữa khỏi U Xơ Thần Kinh hay không?,"Không có thuốc chữa khỏi hoàn toàn U Xơ Thần Kinh, nhưng thuốc có thể giúp kiểm soát các triệu chứng như động kinh, đau đớn hoặc các vấn đề thần kinh khác."
 Tôi cần phải làm gì nếu nghi ngờ mình bị u xơ thần kinh?,"Nếu nghi ngờ mắc u xơ thần kinh, bạn cần thăm khám bác sĩ để được chẩn đoán chính xác và tư vấn về phương pháp điều trị. Điều trị có thể bao gồm thuốc chống động kinh, phẫu thuật nếu cần thiết, và theo dõi để kiểm soát triệu chứng, giảm các ảnh hưởng của bệnh."
Các vấn đề về thần kinh tự trị liên quan đến U Xơ Thần Kinh có thể được điều trị không?,"Các vấn đề về thần kinh tự trị liên quan đến U Xơ Thần Kinh có thể được điều trị bằng các phương pháp phù hợp, tùy thuộc vào nguyên nhân và mức độ nghiêm trọng. Bạn nên trao đổi với bác sĩ để được tư vấn và điều trị phù hợp."
U Xơ Thần Kinh biểu hiện những đặc điểm nào về da?,"Da của những người bị U Xơ Thần Kinh có thể có các biểu hiện ngoài vết café au lait, chẳng hạn như mụn cóc, u xơ dưới da hoặc các vấn đề bất thường khác."
Trong trường hợp nào u xơ tử cung có khả năng gây ra vấn đề về tuyến giáp?,U xơ phát triển gần tuyến giáp có nhiều khả năng gây ra các vấn đề về tuyến giáp hơn so với những khối u nằm ở các vị trí khác.
U xơ thần kinh có thể gây tê liệt tủy sống không?,"Nếu các u xơ thần kinh phát triển ở tủy sống và không được điều trị kịp thời, chúng có thể gây ra tê liệt tủy sống."
Bệnh U Xơ Thần Kinh có mối liên hệ nào với các vấn đề tiêu hóa?,"Mặc dù ít phổ biến, các khối u xơ có thể tạo áp lực lên các cơ quan tiêu hóa, dẫn đến đau bụng, khó tiêu và đôi khi tắc nghẽn đường tiêu hóa."
U xơ tử cung có liên quan đến vấn đề tuyến giáp không?,"Trong một số trường hợp hiếm hoi, u xơ có thể nằm gần tuyến giáp, gây ra các vấn đề về chức năng tuyến giáp."
Có thể sống chung với U Xơ Thần Kinh mà không gặp bất kỳ thách thức nào không?,"Trong nhiều trường hợp, những người mắc bệnh U Xơ Thần Kinh có thể chung sống hòa bình với tình trạng này nếu các u xơ không gây ra các vấn đề sức khỏe đáng kể. Tuy nhiên, để quản lý các triệu chứng hiệu quả và ngăn ngừa những biến chứng có thể xảy ra trong tương lai, việc theo dõi y tế thường xuyên và điều trị thích hợp là rất quan trọng."
Liệu bệnh U Xơ Thần Kinh có thể khiến tôi cảm thấy kiệt sức và không muốn làm bất cứ điều gì?,"Có thể, những cơn đau và các triệu chứng thần kinh liên tục từ bệnh U Xơ Thần Kinh có thể khiến người bệnh cảm thấy mệt mỏi và kiệt sức, dẫn đến sự mất động lực và không muốn làm bất cứ điều gì."
U xơ thần kinh có gây ra các vấn đề liên quan đến việc cảm nhận vị giác không?,"Đúng vậy, trong một số trường hợp hiếm gặp, khi các khối u ảnh hưởng đến dây thần kinh cảm thụ vị giác, bệnh nhân u xơ thần kinh có thể gặp phải các vấn đề về vị giác, chẳng hạn như mất dần khả năng cảm nhận vị giác hoặc cảm thấy vị đắng."
U Xơ Thần Kinh có thể ảnh hưởng đến cảm giác bằng cách nào khác ngoài tê và đau?,Chúng cũng có thể gây ra cảm giác giảm hoặc mất cảm giác.
 Tôi nghe nói có một xét nghiệm mới có thể chẩn đoán U xơ thần kinh.  Điều đó có đúng không?," Hiện nay chưa có xét nghiệm máu nào được chứng minh hiệu quả trong chẩn đoán U xơ thần kinh. Nếu bạn nghe thông tin đó, hãy tham khảo ý kiến của bác sĩ chuyên khoa.  Thông tin chưa được kiểm chứng có thể gây hiểu lầm."
" Nếu u xơ thần kinh gây đau và tổn thương nghiêm trọng trên da, có giải pháp nào khác ngoài phẫu thuật không?"," Ngoài phẫu thuật, có thể xem xét liệu pháp xạ trị để kiểm soát kích thước hoặc giảm đau do u xơ.  Một số loại thuốc có thể hỗ trợ giảm đau hoặc kiểm soát các triệu chứng khác.  Nên trao đổi với bác sĩ về những lựa chọn khác nhau dựa trên tình trạng cụ thể của bạn."
Liệu Bệnh U Xơ Thần Kinh có gây trở ngại cho việc đi làm không?,"Có, Bệnh U Xơ Thần Kinh có thể khiến các triệu chứng ảnh hưởng đến khả năng làm việc, bao gồm đau đớn, mệt mỏi và khó tập trung."
 U xơ thần kinh có thể gây ảnh hưởng gì đến sức khỏe tổng quát ngoài những tổn thương trực tiếp trên da?," U xơ thần kinh có thể tác động tiêu cực đến toàn bộ cơ thể.  Bên cạnh các vấn đề về da và hệ thần kinh như đau, tê, rối loạn cảm giác, nó cũng có thể gây ra những biến chứng nghiêm trọng về chức năng các cơ quan nội tạng, ảnh hưởng đến khả năng vận động và chất lượng cuộc sống."
 Tôi muốn biết U Xơ Thần Kinh có thể xuất hiện ở độ tuổi nào?,"Bệnh U Xơ Thần Kinh thường bắt đầu xuất hiện từ thời thơ ấu, nhưng các triệu chứng có thể phát triển dần dần qua các năm, và bệnh có thể được chẩn đoán ở bất kỳ độ tuổi nào."
U Xơ Thần Kinh có thể dẫn đến tê bì chân tay không?,"Có thể. U Xơ Thần Kinh có thể gây tổn thương cho các dây thần kinh ngoại vi, dẫn đến các triệu chứng như tê bì, yếu cơ, hoặc đau dọc theo các chi, đặc biệt là nếu các u xơ phát triển gần các dây thần kinh ngoại vi."
Liệu bệnh U Xơ Thần Kinh có thể ảnh hưởng đến sức khỏe hô hấp của tôi không?,"Trong một số trường hợp ít gặp, các u xơ thần kinh có thể mọc gần các cơ quan hô hấp, gây khó thở hoặc các vấn đề về hô hấp do chúng chèn ép vào đường hô hấp."
 Có thuốc nào giúp điều trị u xơ thần kinh không?,"Hiện nay chưa có thuốc đặc trị để ngừng sự phát triển của các u xơ thần kinh, nhưng một số loại thuốc có thể giúp giảm các triệu chứng như đau, ngứa hoặc các vấn đề thần kinh."
Làm sao để biết liệu u xơ thần kinh của tôi có gây ảnh hưởng đến khả năng thở hoặc nuốt hay không?,"Bạn nên đến gặp bác sĩ để được kiểm tra và chẩn đoán. Bác sĩ sẽ sử dụng các phương pháp như siêu âm, chụp cắt lớp vi tính, chụp cộng hưởng từ để đánh giá vị trí và kích thước của u xơ, từ đó xác định xem chúng có gây ảnh hưởng đến đường hô hấp hoặc thực quản hay không."
 Liệu u xơ thần kinh có thể tác động đến hệ thống tim mạch của cơ thể?," U xơ thần kinh, trong một số trường hợp cụ thể, có thể ảnh hưởng đến hệ tim mạch, đặc biệt nếu u xơ phát triển gần hoặc nén các mạch máu, làm gián đoạn lưu thông máu và gây ra các vấn đề về huyết áp."
"Khi mắc U Xơ Thần Kinh, giấc ngủ của bệnh nhân có thể bị ảnh hưởng bởi những biểu hiện cụ thể nào?","Trong trường hợp mắc U Xơ Thần Kinh, các triệu chứng đặc trưng như đau và tê ở các vùng bị ảnh hưởng bởi u thần kinh có khả năng can thiệp vào giấc ngủ bằng cách kéo dài quá trình chìm vào giấc ngủ và làm gián đoạn trạng thái ngủ ổn định, dẫn đến chất lượng giấc ngủ bị suy giảm."
Trẻ mắc u xơ thần kinh có nguy cơ phát triển chậm không?,"Bệnh u xơ thần kinh có thể ảnh hưởng đến sự phát triển thể chất và trí tuệ của trẻ, gây khó khăn trong việc học tập và vận động."
Tôi quan tâm đến nguy cơ di truyền U Xơ Thần Kinh cho con tôi.,"Mặc dù U Xơ Thần Kinh thường không di truyền, nhưng việc tư vấn di truyền có thể hữu ích để thảo luận về rủi ro cụ thể của bạn và các lựa chọn có sẵn."
 U xơ thần kinh có thể ảnh hưởng đến việc hấp thu chất dinh dưỡng trong ruột không?,"Có thể. Nếu u xơ phát triển ở ruột hoặc các cơ quan liên quan đến hấp thu, chúng có thể gây cản trở quá trình này, ảnh hưởng đến việc cơ thể hấp thu các chất dinh dưỡng cần thiết."
U xơ thần kinh có liên quan đến tình trạng mất cảm giác mùi không?,"Dữ liệu hiện tại không chỉ ra khả năng này. Tuy nhiên, nếu các khối u gây áp lực lên dây thần kinh liên quan đến khứu giác, bệnh nhân có thể trải qua các thay đổi về khứu giác, chẳng hạn như mất khứu giác."
U xơ thần kinh có thể làm tổn thương mạch máu não như thế nào?,"U xơ thần kinh có thể gây áp lực lên các mạch máu não, làm giảm lưu lượng máu hoặc dẫn đến vỡ mạch máu.  Điều này có thể gây ra hiện tượng chảy máu hoặc thiếu máu cục bộ."
U xơ thần kinh có ảnh hưởng đến khả năng thưởng thức mùi vị thức ăn không?,"Trong một số trường hợp hiếm gặp, nếu các khối u ảnh hưởng đến dây thần kinh cảm thụ vị giác, bệnh nhân có thể gặp phải những thay đổi trong việc thưởng thức mùi vị thức ăn, chẳng hạn như mất khả năng cảm nhận vị giác hoặc cảm thấy vị đắng."
 Những vấn đề về thị lực nào có thể xảy ra khi bị U Xơ Thần Kinh?," U Xơ Thần Kinh có thể gây u xơ trên dây thần kinh thị giác, dẫn đến các vấn đề về thị lực như giảm thị lực, mờ mắt hoặc thậm chí mất thị lực nếu không được điều trị kịp thời."
 Mức độ ảnh hưởng của u xơ thần kinh đến chức năng tình dục là bao nhiêu?,"Mức độ ảnh hưởng của u xơ thần kinh đến chức năng tình dục phụ thuộc vào vị trí, kích thước và số lượng u xơ. Nó có thể từ nhẹ đến nặng, gây khó khăn hoặc mất hoàn toàn chức năng tình dục."
