Question,Answer
"Tôi có cần phải đến bác sĩ ngay lập tức nếu phát hiện có đốm da ""café au lait"" không?","Nếu bạn hoặc con bạn có các dấu hiệu như đốm da ""café au lait"", các nốt u nhỏ hoặc bất kỳ dấu hiệu bất thường nào trên da, bạn nên tham khảo ý kiến bác sĩ để được kiểm tra và chẩn đoán."
 Liệu u xơ thần kinh có phải là một yếu tố nguy cơ gây đột quỵ không?," Có thể, nếu u xơ gây ra tắc nghẽn hoặc rò rỉ máu ở mạch máu não."
 U Xơ Thần Kinh có nguy hiểm không?," U Xơ Thần Kinh có thể làm tăng nguy cơ mắc một số bệnh khác, bao gồm các bệnh lý thần kinh, bệnh lý về thị giác hoặc các vấn đề tim mạch, đặc biệt nếu các u xơ phát triển gần các cơ quan quan trọng."
 Bệnh U Xơ Thần Kinh có ảnh hưởng gì đến phẫu thuật?," Bệnh U Xơ Thần Kinh ảnh hưởng đến các dây thần kinh và mô, nên phẫu thuật có thể gặp khó khăn và nguy cơ biến chứng cao, đặc biệt nếu các u xơ gần các vùng quan trọng như tủy sống hoặc não."
 Liệu một xét nghiệm máu đơn giản có thể khẳng định tôi bị U xơ thần kinh không?,"Không, không có xét nghiệm máu nào có thể xác định chắc chắn bệnh U xơ thần kinh.  Chẩn đoán cần dựa vào nhiều yếu tố, bao gồm tiền sử bệnh, triệu chứng cụ thể và các hình ảnh y học."
Có nghiên cứu nào về các biện pháp thay thế cho bệnh U Xơ Thần Kinh không?,"Có một số nghiên cứu đang tiến hành để đánh giá hiệu quả của các biện pháp thay thế cho bệnh U Xơ Thần Kinh. Mặc dù chưa có phương pháp thay thế nào được chứng minh là có thể chữa khỏi, một số phương pháp như châm cứu và liệu pháp mùi hương có thể mang lại lợi ích giảm đau và cải thiện chất lượng cuộc sống."
 U xơ thần kinh được điều trị như thế nào?  Những bước nào được thực hiện?,"Điều trị u xơ thần kinh thường bắt đầu bằng việc kiểm soát các triệu chứng, có thể bao gồm thuốc.  Nếu khối u lớn, phẫu thuật có thể cần thiết để loại bỏ nó.  Hỗ trợ tâm lý rất quan trọng để giúp bệnh nhân đối phó với các ảnh hưởng tinh thần của căn bệnh này."
Bệnh U Xơ Thần Kinh ảnh hưởng tới màu sắc da như thế nào?,"U Xơ Thần Kinh có thể dẫn đến các đốm đen hoặc nâu trên da, làm mất cân bằng sắc tố da và tạo nên sự không đều màu."
Liệu các khối u xơ thần kinh có thể được loại bỏ vĩnh viễn bằng phẫu thuật không?,"Phẫu thuật có thể loại bỏ các u xơ gây đau đớn hoặc gây áp lực lên các cơ quan, nhưng vì U Xơ Thần Kinh là bệnh di truyền, các u xơ mới có thể tiếp tục phát triển theo thời gian."
U Xơ Thần Kinh có những biểu hiện bề ngoài nào mà người ta thường nhầm lẫn với các bệnh lý khác?,"Các biểu hiện như vết café au lait, mụn cóc, có thể bị nhầm lẫn với các bệnh lý khác như bệnh tàn nhang, u mỡ, hoặc các bệnh lý di truyền liên quan đến sắc tố."
Liệu bệnh u xơ thần kinh có ảnh hưởng đến chất lượng giấc ngủ không?,"Có, các u xơ thần kinh có thể gây ra các triệu chứng như đau, tê bì, khó chịu, làm gián đoạn giấc ngủ, dẫn đến khó đi vào giấc ngủ và dễ thức giấc trong đêm, ảnh hưởng nghiêm trọng đến chất lượng giấc ngủ."
 Cần lưu ý gì khi phẫu thuật cho người mắc bệnh U Xơ Thần Kinh?,"Cần lưu ý rằng bệnh U Xơ Thần Kinh ảnh hưởng đến các dây thần kinh và mô, nên phẫu thuật có thể gặp khó khăn và nguy cơ biến chứng cao, đặc biệt nếu các u xơ gần các vùng quan trọng như tủy sống hoặc não."
" Nếu chỉ có một bên bố hoặc mẹ bị u xơ thần kinh, nguy cơ con cái mắc bệnh là bao nhiêu?",Nguy cơ mắc bệnh vẫn là 50% nếu chỉ một bên bố hoặc mẹ bị bệnh.
Có phải U Xơ Thần Kinh khi phát triển có thể làm suy giảm thị lực?,"Đúng vậy, U Xơ Thần Kinh có thể gây ra vấn đề về tầm nhìn nếu khối u phát triển gần hoặc trong mắt."
Liệu U Xơ Thần Kinh có thể gây mù lòa?,"Trong trường hợp nghiêm trọng, U Xơ Thần Kinh có thể gây ra các vấn đề về thị lực nghiêm trọng, bao gồm cả mù lòa."
Liệu có thuốc nào có thể ngăn chặn sự phát triển của u xơ thần kinh?,"Hiện nay chưa có thuốc đặc trị để ngừng sự phát triển của các u xơ thần kinh, nhưng một số loại thuốc có thể giúp giảm các triệu chứng như đau, ngứa hoặc các vấn đề thần kinh."
Bệnh U Xơ Thần Kinh biểu hiện thế nào trên da?,"Các vết ""café au lait"", đốm màu nâu, thường là biểu hiện trên da của bệnh U Xơ Thần Kinh, thường xuất hiện từ khi còn nhỏ."
Tình trạng u xơ trong não có thể gây ra những ảnh hưởng bất lợi nào?,"Các u xơ phát triển trong não có thể dẫn đến tổn thương và suy giảm chức năng não, bao gồm trí nhớ, khả năng tập trung và kiểm soát vận động."
Tôi có thể gặp khó khăn trong việc thở hoặc nuốt nếu bị u xơ thần kinh không?,"Nếu các u xơ phát triển gần đường hô hấp hoặc thực quản, chúng có thể gây khó thở hoặc nuốt, đặc biệt nếu các u gây chèn ép vào các cấu trúc này."
 Bệnh nhân U Xơ Thần Kinh có thể gặp vấn đề gì về kiểm soát bàng quang?," Những người mắc U xơ thần kinh có thể gặp các vấn đề như tiểu tiện không kiểm soát được (đái dầm), tiểu buốt, tiểu rắt, tiểu thường xuyên, khó khởi động hoặc khó hoàn thành quá trình tiểu tiện."
Tôi lo lắng rằng tình trạng U Xơ Thần Kinh của mình ảnh hưởng đến chuyện sinh nở.,"Đừng quá lo lắng, phụ nữ mắc U Xơ Thần Kinh vẫn có khả năng sinh con khỏe mạnh. Tuy nhiên, hãy thảo luận với bác sĩ để được theo dõi và chăm sóc thích hợp trong suốt thai kỳ."
Phẫu thuật có thể giúp cải thiện tình trạng của người mắc u xơ thần kinh nguy hiểm đến các cơ quan khác không?,"Phẫu thuật có thể được tiến hành để loại bỏ các khối u xơ thần kinh gây nguy hiểm cho các cơ quan khác. Tuy nhiên, cần hiểu rằng phẫu thuật không thể loại bỏ hoàn toàn tất cả các khối u và các khối u mới có thể hình thành sau đó."
" U xơ thần kinh liên quan đến thận, có phải bệnh lý di truyền không?","Một số loại u xơ thần kinh có thể có liên quan đến yếu tố di truyền, nhưng chưa có bằng chứng rõ ràng về tính di truyền trong trường hợp ảnh hưởng đến thận."
Liệu U Xơ Thần Kinh có ảnh hưởng tiêu cực tới trạng thái tinh thần?,"Có, U Xơ Thần Kinh có thể dẫn đến những vấn đề về sức khỏe tâm lý, cụ thể là lo âu, trầm cảm hoặc rối loạn cảm xúc, đặc biệt khi các triệu chứng bệnh trở nên dai dẳng."
U xơ thần kinh có tác động đến đời sống tình dục không?,"Có thể, u xơ thần kinh có thể ảnh hưởng đến các dây thần kinh liên quan đến chức năng tình dục, dẫn đến khó khăn trong quan hệ hoặc giảm ham muốn."
 Bệnh u xơ thần kinh có thể gây ra các vấn đề gì về khả năng vận động?,"Nếu các u xơ ảnh hưởng đến các dây thần kinh chi phối vận động, người bệnh có thể gặp khó khăn trong việc di chuyển, đi lại hoặc thực hiện các động tác thể chất."
Liệu các u xơ có thể gây ra thiệt hại nghiêm trọng cho não không?,"Trong trường hợp các u xơ phát triển trong não, chúng có thể gây ra tổn thương và ảnh hưởng đến các chức năng nhận thức, bao gồm cả trí nhớ, sự tập trung và khả năng điều khiển cơ thể."
 Tình trạng U Xơ Thần Kinh ở đâu ảnh hưởng nhiều nhất đến kiểm soát bàng quang?," Vị trí của các u xơ thần kinh, đặc biệt là nếu nó nằm gần hoặc ảnh hưởng đến đường dẫn truyền tín hiệu từ não đến bàng quang, có thể gây ra vấn đề về kiểm soát bàng quang mạnh hơn."
Tôi nên làm gì nếu tôi bị u xơ thần kinh và gặp khó khăn trong việc thở hoặc nuốt?,"Nếu bạn bị u xơ thần kinh và gặp khó khăn trong việc thở hoặc nuốt, bạn nên đến gặp bác sĩ để được kiểm tra và điều trị."
Liệu có thể sử dụng thuốc để kiểm soát sự phát triển của các u xơ thần kinh hay không?,"Hiện nay chưa có thuốc đặc trị để ngừng sự phát triển của các u xơ thần kinh, nhưng một số loại thuốc có thể giúp giảm các triệu chứng như đau, ngứa hoặc các vấn đề thần kinh."
Hệ thần kinh tự trị bị ảnh hưởng như thế nào khi mắc U Xơ Thần Kinh?,"Một số người mắc U Xơ Thần Kinh có thể gặp phải các vấn đề với hệ thần kinh tự trị, biểu hiện là huyết áp không ổn định hoặc vấn đề về tiêu hóa."
U xơ thần kinh có thể gây khó khăn trong việc di chuyển không?,"Vâng, nếu u xơ nằm ở vị trí ảnh hưởng đến các cơ hoặc dây thần kinh điều khiển vận động, có thể gây khó khăn trong việc di chuyển, phối hợp và gây ra đau."
U xơ thần kinh gây khó khăn trong việc học tập ở trẻ em như thế nào?,"U xơ thần kinh có thể ảnh hưởng đến các vùng não điều khiển khả năng học hỏi, tư duy và ghi nhớ, gây ra khó khăn trong việc học tập ở trẻ em."
 Rủi ro của u xơ thần kinh đối với mạch máu não được đánh giá như thế nào?,"Rủi ro được đánh giá dựa trên vị trí, kích thước, loại u xơ và các yếu tố khác.  Quá trình chẩn đoán thường bao gồm hình ảnh học (như chụp CT, MRI) và thăm khám lâm sàng."
U Xơ Thần Kinh có thể tạo ra sẹo trên các u xơ không?,"U Xơ Thần Kinh thường biểu hiện bằng các vết café au lait, nhưng các u xơ có thể dẫn đến sẹo hoặc đổi màu da nếu bị can thiệp hoặc chấn thương."
Có phải phẫu thuật U Xơ Thần Kinh luôn an toàn không?,"Mặc dù phẫu thuật thường là một phương pháp điều trị hiệu quả đối với những khối u xơ thần kinh lớn hoặc gây nhiều triệu chứng, nhưng nó cũng có thể gây ra một số biến chứng, gồm có nhiễm trùng, chảy máu và tổn thương dây thần kinh."
Phẫu thuật có phải là giải pháp chữa khỏi U Xơ Thần Kinh bằng cách loại bỏ tất cả các u xơ không?,"Phẫu thuật có thể loại bỏ các u xơ gây đau đớn hoặc gây áp lực lên các cơ quan, nhưng vì U Xơ Thần Kinh là bệnh di truyền, các u xơ mới có thể tiếp tục phát triển theo thời gian."
 Làm sao để biết được u xơ thần kinh có gây ra các vấn đề về hô hấp hay không?,Cách tốt nhất để biết được u xơ thần kinh có gây ra các vấn đề về hô hấp hay không là đến gặp bác sĩ để được kiểm tra và chẩn đoán.
 Bệnh U Xơ Thần Kinh có thể làm giảm năng suất làm việc không?,"  Bệnh U Xơ Thần Kinh có thể làm giảm năng suất làm việc nếu nó gây ra các triệu chứng ảnh hưởng đến khả năng di chuyển, tập trung hoặc chịu đựng cường độ công việc."
 Có phương pháp nào để phòng tránh những ảnh hưởng này của u xơ thần kinh lên sự phát triển hệ thần kinh không?,"Hiện nay chưa có phương pháp phòng tránh ảnh hưởng của u xơ thần kinh lên sự phát triển hệ thần kinh.  Điều quan trọng là phát hiện sớm, điều trị kịp thời, và hỗ trợ tích cực để giảm thiểu tối đa tác động tiêu cực của u xơ thần kinh lên sức khỏe và sự phát triển của người bệnh."
Vấn đề tiêu hóa nào có liên quan đến sự hiện diện của U Xơ Thần Kinh?,"Các vấn đề tiêu hóa thường gặp ở những người mắc U Xơ Thần Kinh bao gồm táo bón, đầy hơi và đau bụng, chủ yếu xảy ra khi các khối u phát triển gần các cơ quan liên quan đến tiêu hóa."
Có trường hợp nào sống lâu với Bệnh U Xơ Thần Kinh không?,"Chắc chắn. Với sự điều trị và theo dõi y tế thích hợp, nhiều người mắc bệnh U Xơ Thần Kinh có thể sống thọ và tận hưởng cuộc sống chất lượng, mặc dù cần quản lý tình trạng sức khỏe của họ một cách cẩn thận."
Khi nào thì U Xơ Thần Kinh thường được phát hiện?,"Bệnh U Xơ Thần Kinh thường bắt đầu xuất hiện từ thời thơ ấu, nhưng các triệu chứng có thể phát triển dần dần qua các năm, và bệnh có thể được chẩn đoán ở bất kỳ độ tuổi nào."
" U xơ thần kinh ảnh hưởng đến khả năng kiểm soát các hoạt động phức tạp như viết chữ, chơi nhạc như thế nào?"," Nếu u xơ chèn ép hoặc tổn thương các dây thần kinh liên quan đến các cử động tinh tế, bệnh nhân có thể gặp khó khăn trong việc thực hiện các hoạt động phức tạp như viết chữ, chơi nhạc, sử dụng dụng cụ, cầm nắm đồ vật nhỏ.  Mức độ khó khăn phụ thuộc vào vị trí và kích thước của u xơ."
 Điều gì xảy ra khi bị U Xơ Thần Kinh ảnh hưởng đến mắt?," U Xơ Thần Kinh có thể gây u xơ trên dây thần kinh thị giác, dẫn đến các vấn đề về thị lực như giảm thị lực, mờ mắt hoặc thậm chí mất thị lực nếu không được điều trị kịp thời."
 Bệnh nhân bị u xơ thần kinh có cần theo dõi thường xuyên về mạch máu não không?," Tùy thuộc vào kích thước, vị trí và loại u xơ, bác sĩ sẽ chỉ định lịch trình theo dõi phù hợp, có thể bao gồm siêu âm Doppler, chụp CT hoặc MRI định kỳ để giám sát tình trạng mạch máu não."
Điều trị U Xơ Thần Kinh bằng thuốc có hiệu quả không?,"Thuốc có thể giúp kiểm soát các triệu chứng của U Xơ Thần Kinh như động kinh, đau đớn hoặc các vấn đề thần kinh khác, nhưng không thể chữa khỏi hoàn toàn bệnh."
 Liệu sự phát triển nhận thức của trẻ em mắc U xơ thần kinh có bị ảnh hưởng không?,"Trong một số trường hợp, U xơ thần kinh có thể ảnh hưởng đến sự phát triển nhận thức thông qua các vấn đề học tập, khó khăn trong tập trung, và các yếu tố tâm lý gây ra.  Tuy nhiên, sự ảnh hưởng này có thể được giảm thiểu thông qua sự hỗ trợ giáo dục và điều trị."
Hiện có những phương án nào để điều trị U Xơ Thần Kinh?,"Các phương pháp điều trị U Xơ Thần Kinh tập trung vào việc kiểm soát triệu chứng,bao gồm bổ sung thuốc chống động kinh, can thiệp phẫu thuật để cắt bỏ các khối u lớn và cung cấp hỗ trợ tâm lý để đối phó với những khó khăn về mặt cảm xúc."
Thuốc nào có thể chữa trị u xơ thần kinh hiệu quả?,"Hiện nay chưa có thuốc đặc trị để ngừng sự phát triển của các u xơ thần kinh, nhưng một số loại thuốc có thể giúp giảm các triệu chứng như đau, ngứa hoặc các vấn đề thần kinh."
Bệnh U Xơ Thần Kinh có tác động như thế nào đến sức khỏe tim mạch?,"Mặc dù U Xơ Thần Kinh thường không ảnh hưởng đến chức năng tim mạch, nhưng trong một số trường hợp, các khối u xơ có thể cản trở mạch máu hoặc gây ra tăng huyết áp, dẫn đến các vấn đề về tim."
"Tôi bị U Xơ Thần Kinh, vậy tôi sẽ chịu đựng căng thẳng như thế nào?","U Xơ Thần Kinh có thể làm nảy sinh những thách thức trong việc đối phó với căng thẳng do liên quan đến các vấn đề sức khỏe thể chất và tâm lý, chẳng hạn như lo lắng hoặc trầm cảm, có thể ảnh hưởng đến chất lượng cuộc sống của bạn."
Liệu U Xơ Thần Kinh có làm thay đổi đặc tính của tóc không?,"Đúng, các u xơ phát triển ở da đầu hoặc gần các dây thần kinh có thể dẫn đến tình trạng rụng tóc, tóc mọc không đều hoặc những bất thường khác về tóc."
" Nếu tôi không có bất kì triệu chứng nào liên quan đến u xơ thần kinh, liệu chúng có thể tự tiêu biến không?"," Mặc dù không có triệu chứng, u xơ thần kinh vẫn cần được theo dõi để đánh giá sự phát triển.  Không thể chắc chắn rằng nó sẽ tự tiêu biến mà không cần quan sát và đánh giá của bác sĩ."
Tôi có thể phẫu thuật để loại bỏ hoàn toàn bệnh U xơ thần kinh?,"Mặc dù có thể phẫu thuật để loại bỏ những u xơ gây ảnh hưởng tiêu cực, nhưng không thể loại bỏ hoàn toàn bệnh U xơ thần kinh do tính di truyền của nó và khả năng xuất hiện u mới theo thời gian."
U Xơ Thần Kinh có nguy hiểm không?,"U Xơ Thần Kinh thường lành tính và không nguy hiểm. Tuy nhiên, nếu u xơ lớn hoặc ở vị trí bất lợi, nó có thể gây ra một số triệu chứng khó chịu hoặc ảnh hưởng đến sức khỏe sinh sản."
Vai trò của U Xơ Thần Kinh đối với hệ miễn dịch là gì?,"U Xơ Thần Kinh không ảnh hưởng trực tiếp đến hệ miễn dịch, tuy nhiên sự phát triển của khối u có thể làm suy yếu hệ thống miễn dịch thông qua việc làm tổn thương hoặc làm suy yếu các cơ quan khác."
 Liệu u xơ thần kinh có gây ra các vấn đề về khả năng vận động hay không?,"Có khả năng nếu các u xơ ảnh hưởng đến các dây thần kinh chi phối vận động. Người bệnh có thể gặp khó khăn trong việc di chuyển, đi lại hoặc thực hiện các động tác thể chất."
Liệu bệnh u xơ thần kinh có ảnh hưởng đến giấc ngủ không?,"Có thể.  Các triệu chứng như đau đớn, co giật, và lo lắng do u xơ thần kinh có thể làm gián đoạn giấc ngủ, dẫn đến khó ngủ và giấc ngủ không ngon giấc."
Có phương pháp nào để ngăn chặn sự hình thành của các u bướu thần kinh hay không?,"Do đặc điểm di truyền của các khối U Xơ Thần Kinh, vẫn chưa có biện pháp chủ động nào giúp ngăn ngừa sự phát triển của chúng. Tuy nhiên, việc theo dõi thường xuyên và nhận được sự chăm sóc y tế thích hợp có thể góp phần làm giảm các hậu quả tiêu cực."
Da của người bệnh U Xơ Thần Kinh có thể biểu hiện các triệu chứng gì?,"U Xơ Thần Kinh có thể gây ra các triệu chứng trên da, bao gồm sự thay đổi sắc tố, với các đốm đen hoặc nâu xuất hiện, khiến da không đều màu."
Có phải tất cả các u xơ thần kinh đều gây ra vấn đề về thận?,"Không, không phải tất cả các u xơ thần kinh đều ảnh hưởng đến thận. Chỉ khi các u này phát triển ở vị trí gần thận thì mới có khả năng gây ra các vấn đề về thận, như suy giảm chức năng thận hoặc sỏi thận.  Đây là tình huống rất hiếm gặp."
 Chi phí điều trị U Xơ Thần Kinh kéo dài bao lâu sẽ là bao nhiêu?,Chi phí điều trị U Xơ Thần Kinh sẽ phụ thuộc vào các phương pháp điều trị cụ thể và kéo dài suốt đời.  Bạn nên tham khảo ý kiến bác sĩ và các nguồn tài liệu đáng tin cậy để có cái nhìn tổng quan.
"Nếu u xơ thần kinh gây khó khăn khi đi bộ, liệu có phương pháp hỗ trợ nào?","Có nhiều phương pháp hỗ trợ để giúp người bị u xơ thần kinh đi bộ dễ dàng hơn.  Ví dụ như sử dụng nạng, khung chống đỡ, hoặc các loại giày hỗ trợ.  Vật lý trị liệu cũng có thể giúp cải thiện sức mạnh cơ bắp, phối hợp vận động và kỹ năng giữ thăng bằng.  Ngoài ra, thuốc giảm đau và thuốc hỗ trợ thần kinh cũng có thể giúp giảm triệu chứng.  Nhưng tất cả đều nên được tư vấn bởi bác sĩ."
Các yếu tố nào có thể ảnh hưởng đến khả năng đi lại của người bệnh u xơ thần kinh?,"Các yếu tố có thể ảnh hưởng đến khả năng đi lại của người bệnh u xơ thần kinh bao gồm vị trí và kích thước của u xơ, mức độ nghiêm trọng của yếu cơ hoặc tổn thương dây thần kinh vận động."
Tôi có nên gặp bác sĩ nếu tôi thấy những vết café au lait trên da?,"Các vết café au lait là một trong những dấu hiệu ban đầu của U Xơ Thần Kinh, nhưng không phải tất cả các vết này đều dẫn đến bệnh. Tuy nhiên, nếu bạn có nhiều vết hoặc kèm theo các triệu chứng khác, bạn nên đến bác sĩ để được kiểm tra."
U xơ thần kinh ở não có thể gây ra vấn đề gì về ngôn ngữ?,"U xơ thần kinh ở não có thể gây ra các vấn đề về ngôn ngữ như nói lắp, khó phát âm, rối loạn ngôn ngữ hoặc thậm chí mất khả năng nói."
Tôi có nên điều trị u xơ thần kinh để loại bỏ các vết café au lait?,"Điều trị u xơ thần kinh không có tác dụng trực tiếp trong việc loại bỏ các vết café au lait. Tuy nhiên, các bác sĩ có thể hỗ trợ kiểm soát các triệu chứng khác và làm giảm sự xuất hiện của các vết này trên da."
U xơ thần kinh ảnh hưởng đến khả năng học tập như thế nào?,"U xơ thần kinh, khi phát triển trong não, có thể gây ra khó khăn trong việc học tập, tập trung và ghi nhớ, dẫn đến giảm hiệu suất học tập và các hoạt động đòi hỏi sự chú ý tập trung cao."
Các triệu chứng về mắt liên quan đến bệnh u xơ thần kinh là gì?,"Một số triệu chứng về mắt liên quan đến bệnh u xơ thần kinh bao gồm mờ mắt, giảm thị lực, nhìn đôi, đau mắt, và các vấn đề khác về thị giác."
 Các triệu chứng của U Xơ Thần Kinh ở trẻ sơ sinh khác với người lớn thế nào?,"Ở trẻ sơ sinh, các dấu hiệu của U Xơ Thần Kinh thường thể hiện rõ ràng hơn ở dạng các vết café au lait hoặc các u nhỏ trên da. Triệu chứng khác có thể không xuất hiện rõ ràng hoặc dễ nhận biết cho đến khi trẻ lớn hơn.  Người lớn thường có biểu hiện khác như các cơn động kinh, rối loạn thần kinh."
Người bị U Xơ Thần Kinh có thể bị ảnh hưởng đến khả năng di chuyển tay như thế nào?,"Bệnh U Xơ Thần Kinh có thể gây ra các vấn đề về vận động tay, chẳng hạn như khó khăn trong việc cử động tay hoặc cảm giác yếu ở tay, nếu các u xơ ảnh hưởng đến dây thần kinh điều khiển tay."
Bệnh U Xơ Thần Kinh có thể gây ra các triệu chứng gì trên khuôn mặt?,"Nếu các u xơ ảnh hưởng đến các dây thần kinh mặt, chúng có thể gây ra các vấn đề như méo miệng, khó nhai hoặc cảm giác tê liệt nửa mặt."
U xơ thần kinh có thể gây ra những thay đổi hình dạng cơ thể nào? Nêu một vài ví dụ cụ thể.,"Các u xơ thần kinh có thể gây ra những thay đổi hình dạng cơ thể như:
- Biến dạng các phần cơ thể như mặt, mũi, môi, tai, chi.
- Gia tăng mô ở các khu vực như mặt, thân, chi.
- Phồng lên hoặc lồi lõm bất thường ở một số bộ phận cơ thể.
Ví dụ: một u xơ thần kinh phát triển trên mặt có thể khiến mặt bị sưng phồng, hoặc một u xơ thần kinh phát triển ở chân có thể khiến chân bị biến dạng."
